{
  "schemaVersion": 1,
  "frontend": {
    "host": "127.0.0.1",
    "port": 5174
  },
  "backend": {
    "host": "127.0.0.1",
    "port": 8766
  },
  "dataRoot": "E:\\ReadWebData\\SubtitleWorkflow-Next",
  "python": {
    "executable": "python"
  },
  "tools": {
    "ytDlp": "yt-dlp",
    "whisperx": "whisperx",
    "ffmpeg": "ffmpeg"
  },
  "network": {
    "proxyUrl": ""
  },
  "ai": {
    "model": "gemini-2.5-flash",
    "baseUrl": ""
  }
}
