{
  "schemaVersion": 1,
  "profileId": "optimization",
  "transportMode": "private-lan",
  "configuredLanHost": "active-private-ipv4",
  "frontend": {
    "host": "active-private-ipv4",
    "port": 5184,
    "publicUrl": "active-private-ipv4"
  },
  "backend": {
    "host": "127.0.0.1",
    "port": 8776
  },
  "dataRoot": "E:\\ReadWebData\\SubtitleWorkflow-Optimization"
}
