{
  "schemaVersion": 1,
  "frontend": {
    "host": "127.0.0.1",
    "port": 5184
  },
  "backend": {
    "host": "127.0.0.1",
    "port": 8776
  },
  "dataRoot": "E:\\ReadWebData\\SubtitleWorkflow-Optimization",
  "python": {
    "executable": "E:\\ReadWebRuntime\\optimization-python\\Scripts\\python.exe"
  },
  "tools": {
    "ytDlp": "yt-dlp",
    "whisperx": "%LOCALAPPDATA%\\Read-Web\\whisperx\\Scripts\\whisperx.exe",
    "ffmpeg": "ffmpeg"
  },
  "network": {
    "proxyUrl": "http://127.0.0.1:7897"
  },
  "ai": {
    "model": "gemini-2.5-flash",
    "baseUrl": ""
  }
}
